<!ELEMENT BOOKS (BOOK*) >
<!ELEMENT BOOK (BOOK_TITLE, AUTHOR+,PUBYEAR?) >
<!ELEMENT BOOK_TITLE (#PCDATA) >
<!ELEMENT AUTHOR (#PCDATA) >
<!ELEMENT PUBYEAR (#PCDATA)>